<?xml version="1.0"?>

<upload xmlns:xsi="http://www.w3.org/2001/XMLSchema-instance" xsi:noNamespaceSchemaLocation="D:\System\usa progect\xml\load.xsd">

<schema id='schema1'>
<table name='Client' >
   <field name='Client_No'/>
   <field name='Client_Name'/>
</table>
<table name='Order' >
   <field name='Order_No'/>
    <field name='Client_No' foreign_key_table='Client'/>
    <field name='Quantity' />
	<field name='Delivery_Date'/>
</table>
</schema>

<source id='src1'>
 <infile format='txt-tab' header_rows = '3' field_names_row_numer='3' field_names_format='table.field' update_mode_field_name='I' path='D:\workEclipse\project_1\excel' />
 <outfile format='txt-tab'  error_column='ERR' path='D:\output.txt'/>
</source>
<map source = 'src1' schema='schema1'>
<conversion>
 <trim field_name='Client.Name' />
 <lookup lookup_variable ='Client.Client_No'  lookup_table='Client' lookup_col_in_table ='Client_No'  result_col_in_table='Client_Name' update_into_variable='Order.Client_Name' />

 <substitude>
    <target variable = 'Order.Delivery_Date'/>
	 <value>
	 <trim field_name='Delivery_Date' />
	 <lookup lookup_variable ='Order.Delivery_Date' lookup_table='Order' lookup_col_in_table ='Delivery_Date'  result_col_in_table='Order.Delivery_Date'  />
	 <constant value='Contst1'>
	        
	</constant>
	</value>
 </substitude>
 </conversion>
</map>


</upload>